{
  "$schema": "https://json-schema.org/draft/2020-12/schema",
  "$id": "https://motion-kit.dev/schema/registry-item.json",
  "title": "Motion Kit Registry Item",
  "description": "Contract for a single Motion Kit registry item. Field names are inherited from shadcn's registry-item schema where they overlap, but the set of allowed fields and item types is narrowed to what Motion Kit's CLI and docs site actually use.",
  "type": "object",
  "required": ["name", "type", "title", "description", "files"],
  "additionalProperties": false,
  "properties": {
    "$schema": {
      "type": "string",
      "description": "Should reference this schema's URL once manifests adopt it."
    },
    "name": {
      "type": "string",
      "pattern": "^[a-z0-9]+(-[a-z0-9]+)*$",
      "description": "Kebab-case registry item identifier, unique across the catalog."
    },
    "type": {
      "type": "string",
      "enum": ["registry:component", "registry:lib", "registry:file"],
      "description": "What kind of item this is. registry:lib is for shared helpers under src/registry/lib."
    },
    "title": {
      "type": "string",
      "description": "Human-readable display name shown in docs and CLI output."
    },
    "description": {
      "type": "string",
      "description": "Short summary shown in docs, list output, and info output."
    },
    "author": {
      "type": "string"
    },
    "dependencies": {
      "type": "array",
      "items": { "type": "string" },
      "description": "npm package names to install alongside this item. No version syntax."
    },
    "devDependencies": {
      "type": "array",
      "items": { "type": "string" }
    },
    "registryDependencies": {
      "type": "array",
      "items": { "type": "string" },
      "description": "Names of other Motion Kit registry items (including hidden registry:lib helpers) this item depends on. No version syntax."
    },
    "docs": {
      "type": "string",
      "description": "Optional freeform notes shown alongside an item's docs entry."
    },
    "categories": {
      "type": "array",
      "items": { "type": "string" }
    },
    "meta": {
      "type": "object",
      "description": "Unrestricted bag for tooling-specific metadata, e.g. meta.hidden to keep an item out of normal catalog browsing."
    },
    "files": {
      "type": "array",
      "minItems": 1,
      "items": { "$ref": "#/$defs/file" }
    },
    "usage": {
      "type": "array",
      "description": "Ordered list of framework-labeled usage examples shown in docs.",
      "items": {
        "type": "object",
        "required": ["label", "code"],
        "additionalProperties": false,
        "properties": {
          "label": { "type": "string" },
          "code": { "type": "string" }
        }
      }
    },
    "props": {
      "type": "array",
      "description": "Optional, docs-level description of the element's public props/attributes.",
      "items": {
        "type": "object",
        "required": ["name", "type", "default", "description"],
        "additionalProperties": false,
        "properties": {
          "name": { "type": "string" },
          "type": { "type": "string" },
          "default": { "type": "string" },
          "description": { "type": "string" }
        }
      }
    }
  },
  "$defs": {
    "file": {
      "type": "object",
      "required": ["path", "type", "target"],
      "additionalProperties": false,
      "properties": {
        "path": {
          "type": "string",
          "description": "Source-relative path to the file. Generated payloads rewrite this to a full src/registry/<group>/<name>/... path."
        },
        "type": {
          "type": "string",
          "enum": ["registry:component", "registry:lib", "registry:file"]
        },
        "target": {
          "type": "string",
          "description": "Path the consumer's project should install this file at."
        },
        "content": {
          "type": "string",
          "description": "Inlined file content. Only present in generated payloads, and only for text/code files. Source manifests must omit this; binary assets must never use it."
        },
        "asset": {
          "type": "boolean",
          "description": "Marks a binary/image file. Asset files are referenced by url, never inlined as content."
        },
        "url": {
          "type": "string",
          "format": "uri",
          "description": "Absolute URL the asset is served from. Required when asset is set."
        }
      },
      "if": {
        "required": ["asset"]
      },
      "then": {
        "required": ["url"],
        "not": { "required": ["content"] }
      }
    }
  }
}
