{
  "$schema": "http://localhost:4321/schema/registry-item.json",
  "name": "slideshow",
  "type": "registry:component",
  "title": "Slideshow",
  "description": "Full-bleed image slideshow with parallax slide transitions and thumbnail navigation. Framework-agnostic Custom Element.",
  "dependencies": [
    "lit",
    "gsap"
  ],
  "files": [
    {
      "path": "src/registry/showcase/slideshow/slideshow-element.ts",
      "type": "registry:component",
      "target": "src/components/motion-blocks/slideshow-element.ts",
      "content": "import { LitElement, html, css } from \"lit\"\nimport { customElement, property, state } from \"lit/decorators.js\"\nimport { gsap } from \"gsap\"\nimport { CustomEase } from \"gsap/dist/CustomEase\"\n\ngsap.registerPlugin(CustomEase)\n\nconst EASE = \"motion-blocks-ease\"\nlet _easeRegistered = false\nfunction ensureEase() {\n  if (!_easeRegistered) {\n    CustomEase.create(EASE, \"0.625, 0.05, 0, 1\")\n    _easeRegistered = true\n  }\n}\n\ninterface SlideImage {\n  src: string\n  alt?: string\n}\n\n/**\n * Horizontal parallax slideshow with thumbnail navigation. Each slide\n * transitions with a counterpart inner-image parallax effect.\n *\n * @example\n * <motion-slideshow\n *   images='[{\"src\":\"/1.jpg\",\"alt\":\"One\"},{\"src\":\"/2.jpg\",\"alt\":\"Two\"}]'\n *   class=\"aspect-video w-full max-w-2xl rounded-xl overflow-hidden\"\n * ></motion-slideshow>\n */\n@customElement(\"motion-slideshow\")\nexport class MotionSlideshow extends LitElement {\n  static override styles = css`\n    :host {\n      display: block;\n      position: relative;\n      overflow: hidden;\n    }\n    .slide {\n      pointer-events: none;\n      position: absolute;\n      inset: 0;\n      z-index: 0;\n      overflow: hidden;\n      will-change: transform;\n    }\n    .inner {\n      position: absolute;\n      inset: 0;\n      width: 100%;\n      height: 100%;\n      object-fit: cover;\n      will-change: transform;\n      -webkit-user-drag: none;\n      user-select: none;\n      pointer-events: none;\n    }\n    .thumbs {\n      position: absolute;\n      bottom: 1rem;\n      left: 50%;\n      transform: translateX(-50%);\n      z-index: 50;\n      display: flex;\n      gap: 0.5rem;\n    }\n    .thumb {\n      position: relative;\n      width: 2.5rem;\n      height: 2.5rem;\n      overflow: hidden;\n      border-radius: 0.25rem;\n      border: none;\n      padding: 0;\n      cursor: pointer;\n      transition: transform 0.7s cubic-bezier(0.625, 0.05, 0, 1),\n        opacity 0.3s ease;\n      opacity: 0.6;\n    }\n    .thumb:hover,\n    .thumb.active {\n      opacity: 1;\n      transform: scale(1.1);\n    }\n    .thumb img {\n      width: 100%;\n      height: 100%;\n      object-fit: cover;\n      display: block;\n      pointer-events: none;\n    }\n  `\n\n  /** JSON array: `[{\"src\":\"...\",\"alt\":\"...\"}]` */\n  @property({ type: String }) images = \"[]\"\n\n  @state() private _currentIndex = 0\n\n  private _isAnimating = false\n  private _ctx?: gsap.Context\n\n  override connectedCallback() {\n    super.connectedCallback()\n    ensureEase()\n  }\n\n  override disconnectedCallback() {\n    super.disconnectedCallback()\n    this._ctx?.revert()\n  }\n\n  override firstUpdated() {\n    this._ctx = gsap.context(() => {}, this.shadowRoot as unknown as Element)\n    const slides = this._getSlides()\n    if (slides[0]) gsap.set(slides[0], { zIndex: 10 })\n  }\n\n  replay() {\n    this._ctx?.revert()\n    this._isAnimating = false\n    this._currentIndex = 0\n    requestAnimationFrame(() => {\n      this._ctx = gsap.context(() => {}, this.shadowRoot as unknown as Element)\n      const slides = this._getSlides()\n      slides.forEach((s, i) => gsap.set(s, { zIndex: i === 0 ? 10 : 0, xPercent: 0 }))\n      const inners = this._getInners()\n      inners.forEach((inner) => gsap.set(inner, { xPercent: 0 }))\n    })\n  }\n\n  navigate(targetIndex: number) {\n    const images: SlideImage[] = JSON.parse(this.images)\n    if (\n      this._isAnimating ||\n      targetIndex === this._currentIndex ||\n      targetIndex < 0 ||\n      targetIndex >= images.length\n    )\n      return\n\n    this._isAnimating = true\n    const direction = targetIndex > this._currentIndex ? 1 : -1\n    const prevIndex = this._currentIndex\n    this._currentIndex = targetIndex\n\n    const slides = this._getSlides()\n    const inners = this._getInners()\n    const prevSlide = slides[prevIndex]\n    const prevInner = inners[prevIndex]\n    const nextSlide = slides[this._currentIndex]\n    const nextInner = inners[this._currentIndex]\n\n    if (!prevSlide || !nextSlide) {\n      this._isAnimating = false\n      return\n    }\n\n    gsap.set(nextSlide, { zIndex: 20 })\n    gsap.set(prevSlide, { zIndex: 10 })\n\n    const tl = gsap.timeline({\n      defaults: { duration: 1.5, ease: EASE },\n      onComplete: () => {\n        this._isAnimating = false\n        gsap.set(prevSlide, { zIndex: 0, xPercent: 0 })\n        if (prevInner) gsap.set(prevInner, { xPercent: 0 })\n        gsap.set(nextSlide, { zIndex: 10 })\n      },\n    })\n\n    tl.to(prevSlide, { xPercent: -direction * 100 }, 0)\n    if (prevInner) tl.to(prevInner, { xPercent: direction * 75 }, 0)\n    tl.fromTo(nextSlide, { xPercent: direction * 100 }, { xPercent: 0 }, 0)\n    if (nextInner) tl.fromTo(nextInner, { xPercent: -direction * 75 }, { xPercent: 0 }, 0)\n  }\n\n  private _getSlides() {\n    return Array.from(this.shadowRoot!.querySelectorAll<HTMLElement>(\".slide\"))\n  }\n\n  private _getInners() {\n    return Array.from(this.shadowRoot!.querySelectorAll<HTMLElement>(\".inner\"))\n  }\n\n  override render() {\n    const images: SlideImage[] = JSON.parse(this.images)\n    return html`\n      ${images.map(\n        (img, i) => html`\n          <div class=\"slide\">\n            <img\n              class=\"inner\"\n              src=\"${img.src}\"\n              alt=\"${img.alt ?? \"\"}\"\n              draggable=\"false\"\n            />\n          </div>\n        `,\n      )}\n      <div class=\"thumbs\">\n        ${images.map(\n          (img, i) => html`\n            <button\n              class=\"thumb ${i === this._currentIndex ? \"active\" : \"\"}\"\n              aria-label=\"Go to slide ${i + 1}\"\n              @click=\"${() => this.navigate(i)}\"\n            >\n              <img src=\"${img.src}\" alt=\"${img.alt ?? \"\"}\" draggable=\"false\" />\n            </button>\n          `,\n        )}\n      </div>\n    `\n  }\n}\n\ndeclare global {\n  interface HTMLElementTagNameMap {\n    \"motion-slideshow\": MotionSlideshow\n  }\n}\n"
    }
  ],
  "usage": [
    {
      "label": "Astro",
      "code": "---\nimport \"@/components/motion-blocks/slideshow-element.ts\";\n---\n\n<motion-slideshow\n  images='[{\"src\":\"/1.jpg\",\"alt\":\"One\"},{\"src\":\"/2.jpg\",\"alt\":\"Two\"}]'\n  class=\"aspect-video w-full max-w-2xl rounded-xl overflow-hidden\"\n></motion-slideshow>"
    },
    {
      "label": "React",
      "code": "import \"@/components/motion-blocks/slideshow-element.ts\";\n\nexport default function Page() {\n  return (\n    <motion-slideshow\n      images='[{\"src\":\"/1.jpg\",\"alt\":\"One\"},{\"src\":\"/2.jpg\",\"alt\":\"Two\"}]'\n      class=\"aspect-video w-full max-w-2xl rounded-xl overflow-hidden\"\n    />\n  );\n}"
    },
    {
      "label": "Vue",
      "code": "<script setup>\nimport \"@/components/motion-blocks/slideshow-element.ts\";\n</script>\n\n<template>\n  <motion-slideshow\n    :images='JSON.stringify([{\"src\":\"/1.jpg\",\"alt\":\"One\"},{\"src\":\"/2.jpg\",\"alt\":\"Two\"}])'\n    class=\"aspect-video w-full max-w-2xl rounded-xl overflow-hidden\"\n  />\n</template>"
    },
    {
      "label": "Svelte",
      "code": "<script>\n  import \"@/components/motion-blocks/slideshow-element.ts\";\n</script>\n\n<motion-slideshow\n  images='[{\"src\":\"/1.jpg\",\"alt\":\"One\"},{\"src\":\"/2.jpg\",\"alt\":\"Two\"}]'\n  class=\"aspect-video w-full max-w-2xl rounded-xl overflow-hidden\"\n/>"
    },
    {
      "label": "HTML",
      "code": "<script type=\"module\" src=\"/components/motion-blocks/slideshow-element.js\"></script>\n\n<motion-slideshow\n  images='[{\"src\":\"/1.jpg\",\"alt\":\"One\"},{\"src\":\"/2.jpg\",\"alt\":\"Two\"}]'\n  class=\"aspect-video w-full max-w-2xl rounded-xl overflow-hidden\"\n></motion-slideshow>"
    }
  ],
  "props": [
    {
      "name": "images",
      "type": "string",
      "default": "\"[]\"",
      "description": "JSON array of image objects with src and alt properties."
    }
  ]
}
