{
  "$schema": "https://ui.shadcn.com/schema/registry-item.json",
  "name": "progressive-blur",
  "title": "Progressive Blur",
  "description": "Native custom element that stacks masked backdrop-blur layers to create a directional progressive blur.",
  "dependencies": [],
  "files": [
    {
      "path": "src/registry/new-york/blocks/progressive-blur/progressive-blur-element.ts",
      "type": "registry:component",
      "target": "src/components/motion-kit/progressive-blur-element.ts",
      "content": "const GRADIENT_ANGLES = {\n  top: 0,\n  right: 90,\n  bottom: 180,\n  left: 270,\n} as const\n\ntype ProgressiveBlurDirection = keyof typeof GRADIENT_ANGLES\n\nconst BLUR_STEPS = [1, 2, 4, 8, 16, 32, 64] as const\n\nconst MASK_PRESETS = [\n  [\n    [0, 0],\n    [1, 10],\n    [1, 30],\n    [0, 40],\n  ],\n  [\n    [0, 10],\n    [1, 20],\n    [1, 40],\n    [0, 50],\n  ],\n  [\n    [0, 15],\n    [1, 30],\n    [1, 50],\n    [0, 60],\n  ],\n  [\n    [0, 20],\n    [1, 40],\n    [1, 60],\n    [0, 70],\n  ],\n  [\n    [0, 40],\n    [1, 60],\n    [1, 80],\n    [0, 90],\n  ],\n  [\n    [0, 60],\n    [1, 80],\n  ],\n  [\n    [0, 70],\n    [1, 100],\n  ],\n] as const\n\n/**\n * Native custom element that stacks masked backdrop-blur layers to create\n * a directional progressive blur.\n *\n * @example\n * <motion-progressive-blur\n *   direction=\"bottom\"\n *   blur-layers=\"8\"\n *   blur-intensity=\"0.25\"\n * ></motion-progressive-blur>\n */\nexport class MotionProgressiveBlur extends HTMLElement {\n  static observedAttributes = [\n    \"direction\",\n    \"blur-layers\",\n    \"blur-intensity\",\n    \"fade-color\",\n  ]\n\n  get direction(): ProgressiveBlurDirection {\n    const direction = this.getAttribute(\"direction\")\n    return direction in GRADIENT_ANGLES\n      ? (direction as ProgressiveBlurDirection)\n      : \"bottom\"\n  }\n\n  get blurLayers() {\n    return Math.min(\n      Math.max(Number(this.getAttribute(\"blur-layers\") ?? BLUR_STEPS.length), 2),\n      BLUR_STEPS.length,\n    )\n  }\n\n  get blurIntensity() {\n    return Number(this.getAttribute(\"blur-intensity\") ?? 1)\n  }\n\n  get fadeColor() {\n    return this.getAttribute(\"fade-color\")\n  }\n\n  connectedCallback() {\n    if (!this.style.display && getComputedStyle(this).display === \"inline\") {\n      this.style.display = \"block\"\n    }\n\n    if (!this.style.position && getComputedStyle(this).position === \"static\") {\n      this.style.position = \"relative\"\n    }\n\n    this._renderLayers()\n  }\n\n  attributeChangedCallback() {\n    if (this.isConnected) {\n      this._renderLayers()\n    }\n  }\n\n  replay() {\n    this._renderLayers()\n  }\n\n  private _renderLayers() {\n    const angle = GRADIENT_ANGLES[this.direction]\n    const fragment = document.createDocumentFragment()\n    this.replaceChildren()\n\n    for (let index = 0; index < this.blurLayers; index += 1) {\n      const layer = document.createElement(\"div\")\n      const stops = MASK_PRESETS[index]\n        .map(\n          ([alpha, position]) =>\n            `rgba(0, 0, 0, ${alpha}) ${position}%`,\n        )\n        .join(\", \")\n      const gradient = `linear-gradient(${angle}deg, ${stops})`\n\n      layer.ariaHidden = \"true\"\n      Object.assign(layer.style, {\n        position: \"absolute\",\n        inset: \"0\",\n        borderRadius: \"inherit\",\n        pointerEvents: \"none\",\n        backgroundColor: \"transparent\",\n      })\n      layer.style.maskImage = gradient\n      layer.style.webkitMaskImage = gradient\n      layer.style.backdropFilter = `blur(${BLUR_STEPS[index] * this.blurIntensity}px)`\n      layer.style.webkitBackdropFilter = `blur(${BLUR_STEPS[index] * this.blurIntensity}px)`\n      fragment.append(layer)\n    }\n\n    if (this.fadeColor) {\n      const gradientLayer = document.createElement(\"div\")\n      const gradientDirection = `to ${this.direction}`\n\n      gradientLayer.ariaHidden = \"true\"\n      Object.assign(gradientLayer.style, {\n        position: \"absolute\",\n        inset: \"0\",\n        borderRadius: \"inherit\",\n        pointerEvents: \"none\",\n        background: `linear-gradient(${gradientDirection}, transparent, ${this.fadeColor})`,\n      })\n\n      fragment.append(gradientLayer)\n    }\n\n    this.append(fragment)\n  }\n}\n\nif (!customElements.get(\"motion-progressive-blur\")) {\n  customElements.define(\"motion-progressive-blur\", MotionProgressiveBlur)\n}\n\ndeclare global {\n  interface HTMLElementTagNameMap {\n    \"motion-progressive-blur\": MotionProgressiveBlur\n  }\n}\n"
    }
  ],
  "type": "registry:component"
}
