{
  "$schema": "https://ui.shadcn.com/schema/registry-item.json",
  "name": "lava-lamp",
  "type": "registry:component",
  "title": "Lava Lamp",
  "description": "Raymarched metaball blobs rendered with a smooth-min SDF and Fresnel edge lighting. Creates a fluid, organic lava lamp animation.",
  "dependencies": ["lit", "ogl"],
  "files": [
    {
      "path": "src/registry/canvas/lava-lamp/lava-lamp-element.ts",
      "type": "registry:component",
      "target": "src/components/motion-kit/lava-lamp-element.ts"
    }
  ],
  "usage": [
    {
      "label": "Astro",
      "code": "---\nimport \"@/components/motion-kit/lava-lamp-element.ts\";\n---\n\n<motion-lava-lamp\n  color=\"#17181A\"\n  fresnel-color=\"#ff6900\"\n  speed=\"1.0\"\n  fresnel-power=\"3.0\"\n  radius=\"1\"\n  smoothness=\"0.1\"\n  class=\"w-full h-[500px]\"\n/>"
    },
    {
      "label": "React",
      "code": "import \"@/components/motion-kit/lava-lamp-element.ts\";\n\nexport default function Page() {\n  return (\n    <motion-lava-lamp\n      color=\"#17181A\"\n      fresnel-color=\"#ff6900\"\n      speed={1.0}\n      fresnel-power={3.0}\n      radius={1}\n      smoothness={0.1}\n      className=\"w-full h-[500px]\"\n    />\n  );\n}"
    },
    {
      "label": "Vue",
      "code": "<script setup>\nimport \"@/components/motion-kit/lava-lamp-element.ts\";\n</script>\n\n<template>\n  <motion-lava-lamp\n    color=\"#17181A\"\n    fresnel-color=\"#ff6900\"\n    :speed=\"1.0\"\n    :fresnel-power=\"3.0\"\n    :radius=\"1\"\n    :smoothness=\"0.1\"\n    class=\"w-full h-[500px]\"\n  />\n</template>"
    },
    {
      "label": "Svelte",
      "code": "<script>\n  import \"@/components/motion-kit/lava-lamp-element.ts\";\n</script>\n\n<motion-lava-lamp\n  color=\"#17181A\"\n  fresnel-color=\"#ff6900\"\n  speed={1.0}\n  fresnel-power={3.0}\n  radius={1}\n  smoothness={0.1}\n  class=\"w-full h-[500px]\"\n/>"
    },
    {
      "label": "HTML",
      "code": "<script type=\"module\" src=\"/components/motion-kit/lava-lamp-element.js\"></script>\n\n<motion-lava-lamp\n  color=\"#17181A\"\n  fresnel-color=\"#ff6900\"\n  speed=\"1.0\"\n  fresnel-power=\"3.0\"\n  radius=\"1\"\n  smoothness=\"0.1\"\n  class=\"w-full h-[500px]\"\n/>"
    }
  ],
  "props": [
    {
      "name": "color",
      "type": "string",
      "default": "#17181A",
      "description": "Base body color of the lava blobs."
    },
    {
      "name": "fresnel-color",
      "type": "string",
      "default": "#ff6900",
      "description": "Color applied at blob edges via the Fresnel effect."
    },
    {
      "name": "speed",
      "type": "number",
      "default": "1.0",
      "description": "Animation speed multiplier."
    },
    {
      "name": "fresnel-power",
      "type": "number",
      "default": "3.0",
      "description": "Controls the sharpness of the Fresnel edge glow."
    },
    {
      "name": "radius",
      "type": "number",
      "default": "1",
      "description": "Base radius of the blobs."
    },
    {
      "name": "smoothness",
      "type": "number",
      "default": "0.1",
      "description": "Smoothness of the blob blending (metaball merge factor)."
    },
    {
      "name": "scale",
      "type": "number",
      "default": "1",
      "description": "Scale multiplier for the lava field."
    },
    {
      "name": "rotation",
      "type": "number",
      "default": "0",
      "description": "Lava field rotation in degrees."
    },
    {
      "name": "offset-x",
      "type": "number",
      "default": "0",
      "description": "Horizontal offset in normalized viewport units."
    },
    {
      "name": "offset-y",
      "type": "number",
      "default": "0",
      "description": "Vertical offset in normalized viewport units."
    }
  ]
}
