{
  "$schema": "https://ui.shadcn.com/schema/registry-item.json",
  "name": "plasma-grid",
  "title": "Plasma Grid",
  "description": "Animated plasma grid effect rendered in WebGL. Creates a checkerboard grid pattern with flowing plasma noise gradients. Colors are customizable via props. Lit Custom Element.",
  "dependencies": [
    "lit",
    "ogl"
  ],
  "files": [
    {
      "path": "src/registry/canvas/plasma-grid/plasma-grid-element.ts",
      "content": "import { LitElement, html, css } from \"lit\"\nimport { customElement, property } from \"lit/decorators.js\"\nimport { Camera, Mesh, Program, Renderer, Transform, Triangle, Vec3 } from \"ogl\"\nimport { toLinearRgb, type ColorRepresentation } from \"@/lib/helpers/color\"\n\nconst VERTEX = `\n  attribute vec2 uv;\n  attribute vec2 position;\n  varying vec2 vUv;\n\n  void main() {\n    vUv = uv;\n    gl_Position = vec4(position, 0.0, 1.0);\n  }\n`\n\nconst FRAGMENT = `\n  precision highp float;\n  varying vec2 vUv;\n  uniform float uTime;\n  uniform vec3 uResolution;\n  uniform vec3 uBaseColor;\n  uniform vec3 uGradientColor;\n\n  float rand(vec2 p) {\n    return fract(sin(dot(p, vec2(12.543,514.123)))*4732.12);\n  }\n\n  float noise(vec2 p) {\n    vec2 f = smoothstep(0.0, 1.0, fract(p));\n    vec2 i = floor(p);\n    float a = rand(i);\n    float b = rand(i+vec2(1.0,0.0));\n    float c = rand(i+vec2(0.0,1.0));\n    float d = rand(i+vec2(1.0,1.0));\n    return mix(mix(a, b, f.x), mix(c, d, f.x), f.y);\n  }\n\n  void mainImage( out vec4 fragColor, in vec2 fragCoord ) {\n    float n = 2.0;\n    vec2 uv = fragCoord/uResolution.y;\n    vec2 uvp = fragCoord/uResolution.xy;\n    uv += 0.75*noise(uv*3.0+uTime/2.0+noise(uv*7.0-uTime/3.0)/2.0)/2.0;\n\n    float grid = (mod(floor((uvp.x)*uResolution.x/n),2.0)==0.0?1.0:0.0) *\n                 (mod(floor((uvp.y)*uResolution.y/n),2.0)==0.0?1.0:0.0);\n\n    vec3 col = mix(uBaseColor, uGradientColor,\n                   5.0 * vec3(pow(1.0-noise(uv*4.0-vec2(0.0, uTime/2.0)), 5.0)));\n\n    col = pow(col, vec3(1.0));\n    float alpha = grid;\n    fragColor = vec4(col, alpha);\n  }\n\n  vec3 linearToSrgb(vec3 color) {\n    vec3 safe = max(color, vec3(0.0));\n    vec3 low = safe * 12.92;\n    vec3 high = 1.055 * pow(safe, vec3(1.0 / 2.4)) - 0.055;\n    vec3 cutoff = step(vec3(0.0031308), safe);\n    return mix(low, high, cutoff);\n  }\n\n  void main() {\n    vec4 fragColor;\n    vec2 fragCoord = vUv * uResolution.xy;\n    mainImage(fragColor, fragCoord);\n    fragColor.rgb = linearToSrgb(fragColor.rgb);\n    gl_FragColor = fragColor;\n  }\n`\n\n@customElement(\"motion-plasma-grid\")\nexport class MotionPlasmaGrid extends LitElement {\n  static override styles = css`\n    :host { display: block; position: relative; width: 100%; height: 100%; }\n    canvas { position: absolute; inset: 0; display: block; width: 100%; height: 100%; }\n  `\n\n  @property({ type: String, attribute: \"color\" })\n  color: ColorRepresentation = \"#17181A\"\n\n  @property({ type: String, attribute: \"highlight-color\" })\n  highlightColor: ColorRepresentation = \"#FF6900\"\n\n  @property({ type: Number })\n  speed = 0.5\n\n  private _raf = 0\n  private _cancelled = false\n  private _uTime?: { value: number }\n  private _uniforms?: {\n    uTime: { value: number }\n    uResolution: { value: Vec3 }\n    uBaseColor: { value: Vec3 }\n    uGradientColor: { value: Vec3 }\n  }\n\n  override firstUpdated() {\n    this._init(this.shadowRoot!.querySelector(\"canvas\")!)\n  }\n\n  override disconnectedCallback() {\n    super.disconnectedCallback()\n    this._cancelled = true\n    cancelAnimationFrame(this._raf)\n  }\n\n  override updated(changed: Map<string, unknown>) {\n    if (this._uniforms) {\n      if (changed.has(\"color\")) {\n        const [r, g, b] = toLinearRgb(this.color, [17 / 255, 17 / 255, 19 / 255])\n        this._uniforms.uBaseColor.value.set(r, g, b)\n      }\n      if (changed.has(\"highlightColor\")) {\n        const [r, g, b] = toLinearRgb(this.highlightColor, [1, 105 / 255, 0])\n        this._uniforms.uGradientColor.value.set(r, g, b)\n      }\n    }\n  }\n\n  replay() {\n    this._cancelled = true\n    cancelAnimationFrame(this._raf)\n    this._uTime = undefined\n    this._init(this.shadowRoot!.querySelector(\"canvas\")!)\n  }\n\n  private _init(canvas: HTMLCanvasElement) {\n    this._cancelled = false\n\n    const renderer = new Renderer({ canvas, alpha: true, dpr: window.devicePixelRatio })\n    const gl = renderer.gl\n    gl.clearColor(0, 0, 0, 0)\n    canvas.style.width = \"100%\"\n    canvas.style.height = \"100%\"\n\n    const camera = new Camera(gl)\n    camera.position.z = 1\n    const scene = new Transform()\n    const geometry = new Triangle(gl)\n\n    const initialBaseColor = toLinearRgb(this.color, [17 / 255, 17 / 255, 19 / 255])\n    const initialHighlightColor = toLinearRgb(this.highlightColor, [1, 105 / 255, 0])\n\n    const uniforms = {\n      uTime: { value: 0 },\n      uResolution: { value: new Vec3(1, 1, 1) },\n      uBaseColor: {\n        value: new Vec3(\n          initialBaseColor[0],\n          initialBaseColor[1],\n          initialBaseColor[2],\n        ),\n      },\n      uGradientColor: {\n        value: new Vec3(\n          initialHighlightColor[0],\n          initialHighlightColor[1],\n          initialHighlightColor[2],\n        ),\n      },\n    }\n    this._uniforms = uniforms\n    this._uTime = uniforms.uTime\n\n    const program = new Program(gl, {\n      vertex: VERTEX,\n      fragment: FRAGMENT,\n      uniforms,\n      transparent: true,\n      depthTest: false,\n      depthWrite: false,\n    })\n\n    const mesh = new Mesh(gl, { geometry, program })\n    mesh.setParent(scene)\n\n    let previous = 0\n    const tick = (now: number) => {\n      if (this._cancelled) return\n\n      const w = Math.max(1, canvas.clientWidth)\n      const h = Math.max(1, canvas.clientHeight)\n      const bufW = Math.round(w * renderer.dpr)\n      const bufH = Math.round(h * renderer.dpr)\n      if (canvas.width !== bufW || canvas.height !== bufH) {\n        canvas.width = bufW\n        canvas.height = bufH\n        renderer.width = w\n        renderer.height = h\n        ;(renderer.state as any).viewport = { x: 0, y: 0, width: null, height: null }\n        uniforms.uResolution.value.set(w, h, 1)\n      }\n\n      const delta = previous ? (now - previous) / 1000 : 0\n      previous = now\n      uniforms.uTime.value += delta * this.speed\n\n      renderer.render({ scene, camera })\n      this._raf = requestAnimationFrame(tick)\n    }\n\n    this._raf = requestAnimationFrame(tick)\n  }\n\n  override render() {\n    return html`<canvas aria-hidden=\"true\"></canvas>`\n  }\n}\n\ndeclare global {\n  interface HTMLElementTagNameMap {\n    \"motion-plasma-grid\": MotionPlasmaGrid\n  }\n}\n",
      "type": "registry:component",
      "target": "src/components/motion-kit/plasma-grid-element.ts"
    }
  ],
  "type": "registry:component"
}