{
  "$schema": "https://ui.shadcn.com/schema/registry-item.json",
  "name": "card-3d",
  "type": "registry:component",
  "title": "Card 3D",
  "description": "OGL-powered 3D card with rounded corners and mouse-tracking parallax rotation.",
  "dependencies": ["lit", "ogl"],
  "files": [
    {
      "path": "src/registry/canvas/card-3d/card-3d-element.ts",
      "type": "registry:component",
      "target": "src/components/motion-kit/card-3d-element.ts"
    }
  ],
  "usage": [
    {
      "label": "Astro",
      "code": "---\nimport \"@/components/motion-kit/card-3d-element.ts\";\n---\n\n<motion-card-3d\n  image=\"/path/to/image.jpg\"\n  width=\"3.2\"\n  height=\"2\"\n  depth=\"0.08\"\n  radius=\"0.15\"\n  class=\"w-full h-[400px]\"\n/>"
    },
    {
      "label": "React",
      "code": "import \"@/components/motion-kit/card-3d-element.ts\";\n\nexport default function Page() {\n  return (\n    <motion-card-3d\n      image=\"/path/to/image.jpg\"\n      width={3.2}\n      height={2}\n      depth={0.08}\n      radius={0.15}\n      className=\"w-full h-[400px]\"\n    />\n  );\n}"
    },
    {
      "label": "Vue",
      "code": "<script setup>\nimport \"@/components/motion-kit/card-3d-element.ts\";\n</script>\n\n<template>\n  <motion-card-3d\n    image=\"/path/to/image.jpg\"\n    :width=\"3.2\"\n    :height=\"2\"\n    :depth=\"0.08\"\n    :radius=\"0.15\"\n    class=\"w-full h-[400px]\"\n  />\n</template>"
    },
    {
      "label": "Svelte",
      "code": "<script>\n  import \"@/components/motion-kit/card-3d-element.ts\";\n</script>\n\n<motion-card-3d\n  image=\"/path/to/image.jpg\"\n  width={3.2}\n  height={2}\n  depth={0.08}\n  radius={0.15}\n  class=\"w-full h-[400px]\"\n/>"
    },
    {
      "label": "HTML",
      "code": "<script type=\"module\" src=\"/components/motion-kit/card-3d-element.js\"></script>\n\n<motion-card-3d\n  image=\"/path/to/image.jpg\"\n  width=\"3.2\"\n  height=\"2\"\n  depth=\"0.08\"\n  radius=\"0.15\"\n  class=\"w-full h-[400px]\"\n/>"
    }
  ],
  "props": [
    {
      "name": "image",
      "type": "string",
      "default": "\"\"",
      "description": "URL of the image to display on the 3D card."
    },
    {
      "name": "width",
      "type": "number",
      "default": "3.2",
      "description": "Width of the card in 3D space units."
    },
    {
      "name": "height",
      "type": "number",
      "default": "2",
      "description": "Height of the card in 3D space units."
    },
    {
      "name": "depth",
      "type": "number",
      "default": "0.08",
      "description": "Thickness/depth of the 3D card geometry."
    },
    {
      "name": "radius",
      "type": "number",
      "default": "0.15",
      "description": "Corner radius for rounded corners (in 3D space units)."
    }
  ]
}
